<flowers xmlns:xsi="http://www.w3.org/2001/XMLSchema-instance"
         xmlns:ns="http://www.example.com/flowers"
          xsi:schemaLocation="http://www.epam.com/test/flowers flowers.xsd">
    <Hybridrose id = '1'>
        <name> Rose</name>
        <soil>Ground soil</soil>
        <color>White</color>
        <growingTips>Grow in warm climate and cut once a year.</growingTips>
        <multiplying>Seeds multiplying</multiplying>
        <blossomTime>all year round</blossomTime>
        <petalQuantity>10</petalQuantity>
        <budType>From small to huge with central bud</budType>
        <gardenRoseSort>Green rose</gardenRoseSort>
        <bushType>Climbing bush</bushType>
    </Hybridrose>

</flowers>